field_name,job_role,required_languages,required_skills
Cybersecurity,Incident Response Analyst,"Python,Bash,PowerShell,Go,JavaScript,Ruby,SQL,Perl,Java,C#","Incident triage,Log analysis,Playbook execution,Root cause analysis,Containment & eradication,Forensics data collection,Reporting,Communication,Automation,Collaboration"
Cybersecurity,Digital Forensics Investigator,"Python,PowerShell,Bash,Perl,Ruby,SQL,C#,Go,Java,JavaScript","Disk imaging,Memory forensics,File system analysis,Artifact reconstruction,Chain of custody,Timeline analysis,Reporting,Evidence preservation,Attention to detail,Legal compliance"
Cybersecurity,Malware Analyst,"Python,C,C++,Assembly,Go,Java,JavaScript,Ruby,Perl,Bash","Static analysis,Dynamic analysis,Reverse engineering,Behavioral analysis,YARA rule creation,Debugging,Obfuscation techniques,Automation,Reporting,Collaboration"
Cybersecurity,Threat Intelligence Analyst,"Python,Bash,PowerShell,SQL,Go,Ruby,JavaScript,Perl,Java,Rust","OSINT collection,Indicator analysis,TTP mapping,STIX/TAXII integration,Threat modeling,Reporting,Briefings,Data visualization,Collaboration,Automation"
Cybersecurity,Cybersecurity Incident Handler,"Python,Bash,PowerShell,Go,JavaScript,Ruby,SQL,Perl,Java,C#","Incident coordination,Playbook development,Stakeholder communication,Escalation management,Containment planning,Root cause analysis,Reporting,Training,Automation,Collaboration"
Cybersecurity,Forensic Data Analyst,"Python,R,SQL,Bash,PowerShell,Java,JavaScript,Perl,Ruby,Go","Data parsing,Timeline reconstruction,Log correlation,Statistical analysis,Visualization,Memory forensics,Disk forensics,Reporting,Attention to detail,Collaboration"
Cybersecurity,SOC Incident Responder,"Python,Bash,PowerShell,SQL,JavaScript,Ruby,Go,Perl,Java,PHP","Alert triage,Incident investigation,Playbook execution,Ticketing systems,Threat hunting,Log analysis,Escalation coordination,Reporting,Collaboration,Automation"
Cybersecurity,Cybercrime Investigator,"Python,Bash,PowerShell,Ruby,Perl,SQL,Java,JavaScript,Go,C#","Digital evidence collection,Blockchain analysis,Open source intelligence,Chain of custody,Legal compliance,Interviewing witnesses,Reporting,Network forensics,Collaboration,Attention to detail"
Cybersecurity,Post-Breach Analyst,"Python,Bash,PowerShell,SQL,JavaScript,Ruby,Go,Perl,Java,Scala","Breach impact analysis,Root cause determination,Data exfiltration detection,Forensic imaging,Timeline reconstruction,Remediation recommendations,Reporting,Compliance assessment,Collaboration,Communication"
Cybersecurity,Triage & Escalation Specialist,"Python,Bash,PowerShell,SQL,JavaScript,Ruby,Go,Perl,PHP,Java","Alert triage,Priority assessment,Escalation procedures,Communication,Ticket management,Playbook adherence,Stakeholder coordination,Reporting,Automation,Collaboration"
Cybersecurity,Penetration Tester (Pentester),"Python, Bash, PowerShell, Ruby, JavaScript, Go, C, C++, SQL","Vulnerability assessment, exploitation techniques, network scanning, social engineering, report writing, risk analysis, incident response, password cracking, scripting, communication"
Cybersecurity,Red Team Operator,"Python, Bash, PowerShell, Go, Ruby, C, C++, JavaScript","Adversary tactics, covert operations, lateral movement, persistence techniques, social engineering, OPSEC, report writing, stealth communication, collaboration, threat modeling"
Cybersecurity,Ethical Hacker,"Python, JavaScript, Bash, Ruby, SQL, C, C++","Vulnerability assessment, penetration testing methodology, web application security, network security, scripting, report writing, risk analysis, ethical guidelines, communication, critical thinking"
Cybersecurity,Adversary Emulation Specialist,"Python, PowerShell, Bash, Go, C#, C++","MITRE ATT&CK framework, threat modeling, TTP mapping, lateral movement, command and control, persistence, adversary profiling, red teaming, report writing, collaboration"
Cybersecurity,Offensive Security Engineer,"Python, C, C++, Bash, Go, Ruby, JavaScript","Exploit development, binary analysis, reverse engineering, network exploitation, vulnerability research, secure coding review, scripting, automation, documentation, teamwork"
Cybersecurity,Application Pentester,"Python, JavaScript, Java, C#, SQL, PHP","Web application security, input validation testing, authentication bypass, session management, API testing, source code review, scripting, report writing, risk assessment, communication"
Cybersecurity,Network Pentester,"Python, Bash, Ruby, PowerShell, C","Network scanning, Vulnerability assessment, Packet analysis, Exploit writing, Port scanning, Firewall evasion, Scripting, Lateral movement, Report writing, Communication"
Cybersecurity,Social Engineering Tester,"Python, PowerShell, Bash, JavaScript, Ruby","Pretexting, Phishing, Vishing, Reconnaissance, Persuasion, Psychology, Elicitation, Scripting, Report writing, Ethics"
Cybersecurity,Exploit Developer,"C, C++, Python, Assembly, Ruby","Reverse engineering, Shellcode development, Buffer overflow exploitation, Code injection, Fuzzing, Vulnerability research, Debugging, Decompilation, Network protocols, Creativity"
Cybersecurity,Threat Simulation Analyst,"Python, PowerShell, Bash, Go, JavaScript","Adversary emulation, Threat modeling, TTP analysis, Detection evasion, Incident response, Scripting, Data analysis, Operational planning, Reporting, Collaboration"
Cybersecurity,IAM Engineer,"Python, Java, Go, PowerShell, JavaScript","Role-Based Access Control, SAML, OAuth, LDAP, Identity Federation, Multi-factor Authentication, Security Auditing"
Cybersecurity,Identity Governance Analyst,"Python, PowerShell, SQL, Bash, JavaScript","Access Certification, Role Mining, Segregation of Duties, Compliance Management, Audit & Reporting, Policy Enforcement, Identity Lifecycle Management, Risk Analysis, Process Documentation, Stakeholder Communication"
Cybersecurity,Access Control Administrator,"Python, PowerShell, Bash, SQL, JavaScript","User Provisioning, RBAC, Group Policy Management, Permission Auditing, Password Management, Ticketing Systems, Troubleshooting, Documentation, Communication, Security Best Practices"
Cybersecurity,SSO (Single Sign-On) Specialist,"Java, Python, C#, JavaScript, PowerShell","SAML, OAuth 2.0, OpenID Connect, Certificate Management, Metadata Exchange, XML, JSON, Protocol Troubleshooting, SSL/TLS"
Cybersecurity,Identity Federation Specialist,"Java, Python, C#, JavaScript, PowerShell","SAML, OAuth 2.0, OpenID Connect, WS-Federation, Trust Relationship Management, Certificate Management, Federation Architecture, XML, JSON, Policy Configuration"
Cybersecurity,Privileged Access Management (PAM) Engineer,"Python, PowerShell, Bash, JavaScript, Go","Credential Vaulting, Session Recording, Access Workflow Automation, Privileged Account Management, RBAC, Separation of Duties, Auditing, Encryption, Vulnerability Assessment, Compliance Management"
Cybersecurity,IAM Architect,"Python, Java, JavaScript, C#, PowerShell, Go","Architecture Design, IAM Strategy, Cloud Identity, SSO, Federation, Authentication Protocols, Scalability Planning, Security Requirements Analysis, Governance, Integration Planning"
Cybersecurity,Directory Services Engineer,"PowerShell, Bash, Python, VBScript, JavaScript","Directory Schema Design, LDAP, DNS, Group Policy, Trust Management, Replication Management, Backup & Recovery, Access Control, Scripting Automation, Troubleshooting"
Cybersecurity,IAM Compliance Specialist,"SQL, Python, PowerShell, Bash, JavaScript","SOX/GDPR/HIPAA Compliance, Audit Preparation, Access Reviews, Policy Development, Risk Assessment, Reporting, Process Improvement, Documentation, Stakeholder Engagement"
Cybersecurity,Role-Based Access Control (RBAC) Analyst,"SQL, Python, PowerShell, JavaScript, Bash","Role Mining, Permission Analysis, Policy Modeling, RBAC Design, Access Reviews, Segregation of Duties, Data Analysis, Documentation, Collaboration"
Cybersecurity,"SOC Analyst (Level 1, 2, 3)","Python, PowerShell, Bash, SQL, JavaScript","Incident Triage, Alert Investigation, Log Analysis, Threat Hunting, Report Writing, Ticketing System Usage, SOP Adherence, Time Management, Communication"
Cybersecurity,Threat Detection Analyst,"Python, SQL, PowerShell, Bash, JavaScript","Threat Hunting, Behavioral Analytics, IOC Analysis, Anomaly Detection, Pattern Recognition, Rule Development, Malware Analysis Basics, Log Correlation, Report Writing"
Cybersecurity,Security Monitoring Engineer,"Python, JavaScript, PowerShell, Bash, Go","Alert Tuning, Dashboard Development, Data Ingestion, Log Parsing, Automation Scripting, API Integration, Performance Optimization, Security Architecture, Data Normalization"
Cybersecurity,SOC Team Lead,"Python, PowerShell, Bash, SQL, Go","Leadership, Incident Management, Playbook Development, Escalation Coordination, Performance Metrics, Team Coaching, Strategic Planning, Stakeholder Communication, Crisis Management"
Cybersecurity,SIEM Engineer (Security Information and Event Management),"Python, SQL, PowerShell, JavaScript, Java","Use Case Development, Correlation Rule Tuning, Log Source Integration, Dashboard Creation, Performance Tuning, Scripting, API Integration, Troubleshooting, Architecture Design"
Cybersecurity,Log Analysis Specialist,"Python, Bash, SQL, PowerShell, Perl","Regex, Log Parsing, Data Normalization, Pattern Matching, Time-Series Analysis, Query Optimization, Data Visualization, Report Generation, Attention to Detail"
Cybersecurity,Security Alert Triage Analyst,"Python, PowerShell, Bash, SQL, JavaScript","Alert Classification, Incident Prioritization, SOP Adherence, Escalation Procedures, Communication, Documentation, SLA Management, Basic Forensics, Time Management"
Cybersecurity,SOC Automation Engineer,"Python, PowerShell, Bash, Go, JavaScript","Playbook Development, API Integration, Scripting Automation, CI/CD, Workflow Orchestration, Error Handling, Testing & Validation, Version Control, Collaboration"
Cybersecurity,Incident Detection & Response Analyst,"Python, PowerShell, Bash, Ruby, SQL","Threat Hunting, Forensic Analysis, Malware Reverse-Engineering Basics, IOC Investigation, Containment Strategies, Root Cause Analysis, Playbook Execution, Report Writing"
Cybersecurity,Cybersecurity Shift Lead,"Python, PowerShell, Bash, SQL, JavaScript","Shift Handover Management, Team Coordination, Incident Oversight, Escalation Management, Performance Reporting, Mentoring, Crisis Communication, Stakeholder Liaison, Compliance Adherence"
